{
  "schema": "reflex-trace/1",
  "provenance": {
    "commit": "8793f2f", "block": "control/pid",
    "scenario": "tools/trace/scenarios/pid/external_saturation.cpp", "seed": 0,
    "compiler": "gcc 15.2 optimized", "dt_sim": 0.001, "dt_trace": 0.01
  },
  "frames": { "world": "z-up", "body": "x-forward y-left z-up", "rotors": "px4-quad-x" },
  "t": [0, 0.01, 0.02, 0.03, 0.04, 0.05, 0.06, 0.07, 0.08, 0.09, 0.1, 0.11, 0.12, 0.13, 0.14, 0.15, 0.16, 0.17, 0.18, 0.19, 0.2, 0.21, 0.22, 0.23, 0.24, 0.25, 0.26, 0.27, 0.28, 0.29, 0.3, 0.31, 0.32, 0.33, 0.34, 0.35000000000000003, 0.36, 0.37, 0.38, 0.39, 0.4, 0.41000000000000003, 0.42, 0.43, 0.44, 0.45, 0.46, 0.47000000000000003, 0.48, 0.49, 0.5, 0.51, 0.52, 0.53, 0.54, 0.55, 0.56, 0.5700000000000001, 0.58, 0.59, 0.6, 0.61, 0.62, 0.63, 0.64, 0.65, 0.66, 0.67, 0.68, 0.6900000000000001, 0.7000000000000001, 0.71, 0.72, 0.73, 0.74, 0.75, 0.76, 0.77, 0.78, 0.79, 0.8, 0.81, 0.8200000000000001, 0.8300000000000001, 0.84, 0.85, 0.86, 0.87, 0.88, 0.89, 0.9, 0.91, 0.92, 0.93, 0.9400000000000001, 0.9500000000000001, 0.96, 0.97, 0.98, 0.99, 1, 1.01, 1.02, 1.03, 1.04, 1.05, 1.06, 1.07, 1.08, 1.09, 1.1, 1.11, 1.12, 1.1300000000000001, 1.1400000000000001, 1.1500000000000001, 1.16, 1.17, 1.18, 1.19, 1.2, 1.21, 1.22, 1.23, 1.24, 1.25, 1.26, 1.27, 1.28, 1.29, 1.3, 1.31, 1.32, 1.33, 1.34, 1.35, 1.36, 1.37, 1.3800000000000001, 1.3900000000000001, 1.4000000000000001, 1.41, 1.42, 1.43, 1.44, 1.45, 1.46, 1.47, 1.48, 1.49, 1.5, 1.51, 1.52, 1.53, 1.54, 1.55, 1.56, 1.57, 1.58, 1.59, 1.6, 1.61, 1.62, 1.6300000000000001, 1.6400000000000001, 1.6500000000000001, 1.6600000000000001, 1.67, 1.68, 1.69, 1.7, 1.71, 1.72, 1.73, 1.74, 1.75, 1.76, 1.77, 1.78, 1.79, 1.8, 1.81, 1.82, 1.83, 1.84, 1.85, 1.86, 1.87, 1.8800000000000001, 1.8900000000000001, 1.9000000000000001, 1.9100000000000001, 1.92, 1.93, 1.94, 1.95, 1.96, 1.97, 1.98, 1.99, 2, 2.0100000000000002, 2.02, 2.0300000000000002, 2.04, 2.05, 2.06, 2.07, 2.08, 2.09, 2.1, 2.11, 2.12, 2.13, 2.14, 2.15, 2.16, 2.17, 2.18, 2.19, 2.2, 2.21, 2.22, 2.23, 2.24, 2.25, 2.2600000000000002, 2.27, 2.2800000000000002, 2.29, 2.3000000000000003, 2.31, 2.32, 2.33, 2.34, 2.35, 2.36, 2.37, 2.38, 2.39, 2.4, 2.41, 2.42, 2.43, 2.44, 2.45, 2.46, 2.47, 2.48, 2.49, 2.5, 2.5100000000000002, 2.52, 2.5300000000000002, 2.54, 2.5500000000000003, 2.56, 2.57, 2.58, 2.59, 2.6, 2.61, 2.62, 2.63, 2.64, 2.65, 2.66, 2.67, 2.68, 2.69, 2.7, 2.71, 2.72, 2.73, 2.74, 2.75, 2.7600000000000002, 2.77, 2.7800000000000002, 2.79, 2.8000000000000003, 2.81, 2.82, 2.83, 2.84, 2.85, 2.86, 2.87, 2.88, 2.89, 2.9, 2.91, 2.92, 2.93, 2.94, 2.95, 2.96, 2.97, 2.98, 2.99, 3, 3.0100000000000002, 3.02, 3.0300000000000002, 3.04, 3.0500000000000003, 3.06, 3.0700000000000003, 3.08, 3.09, 3.1, 3.11, 3.12, 3.13, 3.14, 3.15, 3.16, 3.17, 3.18, 3.19, 3.2, 3.21, 3.22, 3.23, 3.24, 3.25, 3.2600000000000002, 3.27, 3.2800000000000002, 3.29, 3.3000000000000003, 3.31, 3.3200000000000003, 3.33, 3.34, 3.35, 3.36, 3.37, 3.38, 3.39, 3.4, 3.41, 3.42, 3.43, 3.44, 3.45, 3.46, 3.47, 3.48, 3.49, 3.5, 3.5100000000000002, 3.52, 3.5300000000000002, 3.54, 3.5500000000000003, 3.56, 3.5700000000000003, 3.58, 3.59, 3.6, 3.61, 3.62, 3.63, 3.64, 3.65, 3.66, 3.67, 3.68, 3.69, 3.7, 3.71, 3.72, 3.73, 3.74, 3.75, 3.7600000000000002, 3.77, 3.7800000000000002, 3.79, 3.8000000000000003, 3.81, 3.8200000000000003, 3.83, 3.84, 3.85, 3.86, 3.87, 3.88, 3.89, 3.9, 3.91, 3.92, 3.93, 3.94, 3.95, 3.96, 3.97, 3.98, 3.99, 4, 4.01, 4.0200000000000005, 4.03, 4.04, 4.05, 4.0600000000000005, 4.07, 4.08, 4.09, 4.1, 4.11, 4.12, 4.13, 4.14, 4.15, 4.16, 4.17, 4.18, 4.19, 4.2, 4.21, 4.22, 4.23, 4.24, 4.25, 4.26, 4.2700000000000005, 4.28, 4.29, 4.3, 4.3100000000000005, 4.32, 4.33, 4.34, 4.3500000000000005, 4.36, 4.37, 4.38, 4.39, 4.4, 4.41, 4.42, 4.43, 4.44, 4.45, 4.46, 4.47, 4.48, 4.49, 4.5, 4.51, 4.5200000000000005, 4.53, 4.54, 4.55, 4.5600000000000005, 4.57, 4.58, 4.59, 4.6000000000000005, 4.61, 4.62, 4.63, 4.64, 4.65, 4.66, 4.67, 4.68, 4.69, 4.7, 4.71, 4.72, 4.73, 4.74, 4.75, 4.76, 4.7700000000000005, 4.78, 4.79, 4.8, 4.8100000000000005, 4.82, 4.83, 4.84, 4.8500000000000005, 4.86, 4.87, 4.88, 4.89, 4.9, 4.91, 4.92, 4.93, 4.94, 4.95, 4.96, 4.97, 4.98, 4.99, 5],
  "channels": {
    "response": [
      [0, 0],
      [0.0191235849982391, 0.0191235849982391],
      [0.03641861248055383, 0.03641861248055383],
      [0.052059925322343915, 0.052059925322343915],
      [0.06620564828606391, 0.06620564828606391],
      [0.0789987865724927, 0.0789987865724927],
      [0.09056867152184771, 0.09056867152184771],
      [0.10103226807995855, 0.10103226807995855],
      [0.11047042455435056, 0.1104953572472378],
      [0.11901249869487814, 0.11905360546433516],
      [0.12674224079638644, 0.12679353174535407],
      [0.1337309547329396, 0.13379338233579716],
      [0.14005123035438968, 0.14012392173753369],
      [0.14577040896439022, 0.14584914809760113],
      [0.15094485896206236, 0.15102694019301405],
      [0.15562574502373724, 0.15570964255222777],
      [0.15986329352118106, 0.15994459462850205],
      [0.16369580645203147, 0.16377460937480587],
      [0.16716034882485947, 0.16723840605838244],
      [0.1702963905173477, 0.17037100169048408],
      [0.17313362513562547, 0.17320406502840763],
      [0.17570107204390178, 0.1757662367285903],
      [0.1780230849984829, 0.1780834188873303],
      [0.18012265803229094, 0.180179036896225],
      [0.18202144010317073, 0.18207427625953504],
      [0.18374012959294153, 0.1837882967675637],
      [0.1852945687710934, 0.1853384261912223],
      [0.1866987798646747, 0.18674033545592286],
      [0.18797054228338103, 0.18800819706570684],
      [0.18911998958525866, 0.1891548283791873],
      [0.19015981971293208, 0.1901918211857428],
      [0.19110051043550072, 0.19112965889190464],
      [0.19195146116113893, 0.1919778225026248],
      [0.19272055737542476, 0.19274488646883486],
      [0.1934163200381946, 0.1934386053702604],
      [0.19404583785494856, 0.19406599230980445],
      [0.19461462302056057, 0.19463338981202272],
      [0.1951295615926299, 0.1951465339424337],
      [0.19559504098233707, 0.1956106122958734],
      [0.19601623402327722, 0.19603031644012384],
      [0.19639696600605033, 0.19640988934499085],
      [0.1967414806402245, 0.19675316827631156],
      [0.19705305349994992, 0.19706362358852625],
      [0.19733477584059392, 0.1973443938079845],
      [0.19758961904435274, 0.19759831736165875],
      [0.19782009466977, 0.19782796127202434],
      [0.19802853269412382, 0.19803564710819388],
      [0.19821704030709966, 0.19822347445565883],
      [0.19838737798891876, 0.1983933421419026],
      [0.19854157355941351, 0.1985469674324647],
      [0.1986810252694147, 0.1986859033915171],
      [0.19880714289626905, 0.19881155458245814],
      [0.19892120141733885, 0.1989251912672488],
      [0.19902435389929635, 0.19902796224803682],
      [0.19911764315497132, 0.19912090648089265],
      [0.19920201228559473, 0.19920496357906295],
      [0.19927827085696545, 0.1992809833119254],
      [0.1993472811000281, 0.19934973419567312],
      [0.19940969272684597, 0.19941191126257557],
      [0.19946613668341218, 0.1994681430873588],
      [0.1995171835859732, 0.19951899814173774],
      [0.1995633494896341, 0.1995649905413417],
      [0.19960510110538165, 0.19960658524313016],
      [0.19964286051826638, 0.199644202745843],
      [0.19967700945444217, 0.19967822334100305],
      [0.19970789314020015, 0.19970899095744693],
      [0.19973582379200996, 0.1997368166382495],
      [0.19976108377285004, 0.1997619816851923],
      [0.19978392844673687, 0.19978474050256412],
      [0.1998045887603095, 0.19980532316904356],
      [0.19982327357756863, 0.1998239377636635],
      [0.19984017179137267, 0.19984077246937132],
      [0.1998554542330367, 0.19985599747545155],
      [0.19986927539934, 0.19986976669804238],
      [0.1998817750144004, 0.19988221933614028],
      [0.19989307944220558, 0.19989348127882264],
      [0.19990330296408076, 0.19990366637791437],
      [0.19991254893400817, 0.19991287759896512],
      [0.1999209108234766, 0.19992120806217234],
      [0.19992847316642504, 0.19992874198377344],
      [0.19993531241383267, 0.19993555552742404],
      [0.19994149770659467, 0.19994171757416893],
      [0.19994709157449725, 0.19994729041879034],
      [0.19995215056835838, 0.1999523303995728],
      [0.19995672583172397, 0.19995688846785084],
      [0.19996086361790025, 0.19996101070309813],
      [0.1999646057575483, 0.1999647387787648],
      [0.19996799008156815, 0.19996811038357198],
      [0.19997105080354777, 0.19997115960252357],
      [0.19997381886564272, 0.19997391726148617],
      [0.1999763222513839, 0.19997641123882096],
      [0.19997858626857512, 0.199978666747218],
      [0.1999806338051403, 0.19998070658858233],
      [0.19998248556050777, 0.19998255138454807],
      [0.1999841602548694, 0.19998421978495157],
      [0.19998567481843116, 0.1999857286563704],
      [0.1999870445625679, 0.19998709325263514],
      [0.19998828333461252, 0.19998832736903657],
      [0.19998940365784468, 0.1999894434817885],
      [0.19999041685809407, 0.19999045287415504],
      [0.19999133317823803, 0.19999136575051796],
      [0.1999921618817512, 0.19999219133953727],
      [0.199992911346354, 0.1999929379874477],
      [0.1999935891487066, 0.19999361324243417],
      [0.19999420214100472, 0.19999422393094002],
      [0.19999475652025125, 0.19999477622667813],
      [0.19999525789090455, 0.1999952757130438],
      [0.19999571132153635, 0.19999572743955957],
      [0.199996121396072, 0.1999961359729233],
      [0.19999649226013147, 0.1999965054431745],
      [0.19999682766293905, 0.1999968395854469],
      [0.1999971309952262, 0.1999971417777286],
      [0.19999740532350946, 0.19999741507501137],
      [0.19999765342109155, 0.199997662240175],
      [0.1999978777960976, 0.19999788577191863],
      [0.19999808071683112, 0.1999980879300207],
      [0.1999982642347052, 0.19999827075818455],
      [0.19999843020498098, 0.19999843610469872],